{
  "pack_id": "airtel_money",
  "version": "0.1.0",
  "provider": "airtel_money",
  "institution": "Airtel Kenya",
  "sender_ids": [
    "AirtelMoney"
  ],
  "account_ref_template": "airtel_money:{sim_msisdn_masked}",
  "currency": "KES",
  "datetime_formats": [
    "dd/MM/yy 'at' hh:mm a",
    "d/M/yy 'at' h:mm a",
    "dd/MM/yyyy 'at' hh:mm a",
    "d/M/yyyy 'at' h:mm a"
  ],
  "amount_prefixes": [
    "Ksh.",
    "Ksh",
    "KES",
    "KSh",
    "Kshs"
  ],
  "families": [
    {
      "family_id": "bundle_purchase",
      "description": "Data bundle purchase. The ONLY plausible Airtel Money Kenya capture found in public (demo data in a public messaging-app repo with the address recorded as AirtelMoney; numeric transaction id, 'Fee: … Bal: …' labels). Every other Airtel Money family has no sample at all (corpus/airtel-money/MISSING-FAMILIES.md), so this pack has one family at low confidence until a real export arrives. Source: corpus/airtel-money/unverified-public-samples.jsonl.",
      "type": "AIRTIME",
      "direction": "out",
      "counterparty_kind": "merchant",
      "prefilter": {
        "all_of": [
          "purchased a bundle"
        ]
      },
      "pattern": "^(?<external_ref>[A-Z0-9]{6,14})\\s*Confirmed\\.\\s*You have successfully purchased a bundle of Ksh\\s?(?<amount>[\\d,]+(?:\\.\\d{1,2})?) via (?<counterparty_name>.+?) on (?<occurred_at>\\d{1,2}/\\d{1,2}/\\d{2,4}\\s+at\\s+\\d{1,2}:\\d{2}\\s*[AP]M)\\.\\s*Fee:\\s*Ksh\\s?(?<fee>[\\d,]+(?:\\.\\d{1,2})?)\\.\\s*Bal:\\s*Ksh\\s?(?<balance_after>[\\d,]+(?:\\.\\d{1,2})?)",
      "fields": {
        "external_ref": {
          "to": "external_ref",
          "normalise": "code"
        },
        "amount": {
          "to": "amount",
          "normalise": "amount"
        },
        "counterparty_name": {
          "to": "counterparty_name",
          "normalise": "text"
        },
        "occurred_at": {
          "to": "occurred_at",
          "normalise": "datetime"
        },
        "fee": {
          "to": "fee",
          "normalise": "amount"
        },
        "balance_after": {
          "to": "balance_after",
          "normalise": "amount"
        }
      },
      "confidence": 0.6,
      "examples": [
        {
          "body": "XXXXXXXX234 Confirmed. You have successfully purchased a bundle of Ksh 500 via Airtel Networks Kenya Ltd on 09/03/26 at 08:03 AM. Fee: Ksh 0. Bal: Ksh 1,200.00",
          "verified": false,
          "expect": {
            "external_ref": "XXXXXXXX234",
            "amount_cents": 50000,
            "fee_cents": 0,
            "balance_after_cents": 120000,
            "occurred_at": "2026-03-09T08:03:00+03:00",
            "counterparty_name": "Airtel Networks Kenya Ltd",
            "type": "AIRTIME"
          }
        }
      ]
    }
  ]
}
